{
  "qeva_version": "0.1",
  "id": "qeva:1:terminology:chaos",
  "revision": 1,
  "type": "terminology",
  "title": "Chaos",
  "summary": "A family of precise but non-equivalent dynamical notions rather than one universal predicate.",
  "status": "context-dependent",
  "context": {
    "domain": [
      "dynamics",
      "chaos"
    ],
    "formal_system": null,
    "scope_note": null
  },
  "assumptions": [],
  "content": {
    "human": "“Chaos” has several rigorous definitions. QEVA should name the definition being used instead of treating the word as self-explanatory.",
    "exact": "QEVA Protocol 0.1 assigns no universal predicate Chaos(T). A record claiming chaos must identify a contextual criterion (for example a named topological, measure-theoretic, symbolic, or metric definition) and state its hypotheses.",
    "example": "A map may satisfy sensitive dependence while failing some stronger named chaos criterion.",
    "caveat": "Popular descriptions such as “random-looking” or “small errors grow” are not by themselves mathematical definitions of chaos."
  },
  "dependencies": [
    "qeva:1:definition:sensitivity"
  ],
  "relations": [],
  "verification": {
    "level": "editorial",
    "method": "Definition checked for internal consistency; not yet linked to an external formal proof artifact.",
    "artifact": null
  },
  "provenance": {
    "created": "2026-09-04",
    "creator": "QEVA seed archive",
    "license": "CC0-1.0",
    "source_note": "Seed record written to demonstrate QEVA Protocol 0.1; it is not claimed to be the unique foundational presentation of this concept."
  },
  "revision_of": null
}
