{
  "qeva_version": "0.1",
  "id": "qeva:1:terminology:closed-form",
  "revision": 1,
  "type": "terminology",
  "title": "Closed form",
  "summary": "A widely used but non-universal label for formulas considered explicit relative to an allowed vocabulary of operations/functions.",
  "status": "context-dependent",
  "context": {
    "domain": [
      "representation",
      "algebra",
      "analysis"
    ],
    "formal_system": null,
    "scope_note": null
  },
  "assumptions": [],
  "content": {
    "human": "“Closed form” usually means an explicit formula, but what operations are allowed differs by field and author.",
    "exact": "QEVA Protocol 0.1 assigns no universal predicate ClosedForm(E). Any claim that an expression is “closed form” must declare the permitted expression language or cite a contextual convention.",
    "example": "a_n=2^n may be called a closed form for the recurrence a_{n+1}=2a_n, a_0=1 when exponentiation is allowed.",
    "caveat": "Treating “closed form” as one globally defined mathematical property would create false precision."
  },
  "dependencies": [],
  "relations": [
    {
      "kind": "representation-related",
      "target": "qeva:1:definition:recurrence",
      "note": "Explicit formulas are often compared with recurrence representations."
    }
  ],
  "verification": {
    "level": "editorial",
    "method": "Definition checked for internal consistency; not yet linked to an external formal proof artifact.",
    "artifact": null
  },
  "provenance": {
    "created": "2026-09-04",
    "creator": "QEVA seed archive",
    "license": "CC0-1.0",
    "source_note": "Seed record written to demonstrate QEVA Protocol 0.1; it is not claimed to be the unique foundational presentation of this concept."
  },
  "revision_of": null
}
