{
  "qeva_version": "0.1",
  "id": "qeva:1:definition:periodicity",
  "revision": 1,
  "type": "definition",
  "title": "Periodicity of a sequence",
  "summary": "Exact repetition after a fixed positive index shift.",
  "status": "formalized",
  "context": {
    "domain": [
      "dynamics",
      "sequence",
      "recurrence"
    ],
    "formal_system": "sequences indexed by integers or natural numbers",
    "scope_note": null
  },
  "assumptions": [
    "A sequence (a_n) has an index domain on which n+p is defined for the stated n."
  ],
  "content": {
    "human": "A periodic sequence repeats exactly after some fixed positive number of steps.",
    "exact": "A sequence (a_n) is periodic with period p>0 iff a_{n+p}=a_n for every index n for which both terms are in the domain. A least positive such p, when it exists, is called the fundamental period.",
    "example": "0,1,0,1,0,1,... has period 2.",
    "caveat": "Continuous functions, group actions, tilings, and dynamical systems use related but context-specific notions of periodicity."
  },
  "dependencies": [
    "qeva:1:definition:sequence"
  ],
  "relations": [
    {
      "kind": "contrasts-with",
      "target": "qeva:1:definition:quasiperiodicity",
      "note": "Quasiperiodicity can exhibit recurrent structure without one global exact finite period."
    }
  ],
  "verification": {
    "level": "editorial",
    "method": "Definition checked for internal consistency; not yet linked to an external formal proof artifact.",
    "artifact": null
  },
  "provenance": {
    "created": "2026-09-04",
    "creator": "QEVA seed archive",
    "license": "CC0-1.0",
    "source_note": "Seed record written to demonstrate QEVA Protocol 0.1; it is not claimed to be the unique foundational presentation of this concept."
  },
  "revision_of": null
}
