{
  "qeva_version": "0.1",
  "id": "qeva:1:definition:sensitivity",
  "revision": 1,
  "type": "definition",
  "title": "Sensitive dependence on initial conditions",
  "summary": "A metric dynamical property in which arbitrarily nearby starting states can eventually separate by a fixed positive amount.",
  "status": "formalized",
  "context": {
    "domain": [
      "dynamics",
      "chaos",
      "analysis"
    ],
    "formal_system": "metric dynamical systems",
    "scope_note": null
  },
  "assumptions": [
    "(X,d) is a metric space.",
    "T:X→X is a map."
  ],
  "content": {
    "human": "Sensitivity formalizes one kind of error amplification: no matter how closely two starting states are chosen, some nearby state can eventually move a definite distance away.",
    "exact": "T has sensitive dependence on initial conditions iff there exists δ>0 such that for every x in X and every ε>0 there exist y in X and n>=0 with d(x,y)<ε and d(T^n(x),T^n(y))>δ.",
    "example": "In chaotic systems, small initial discrepancies may become macroscopically separated under iteration.",
    "caveat": "Sensitivity alone is not a universal definition of chaos."
  },
  "dependencies": [],
  "relations": [
    {
      "kind": "component-of-some-definitions",
      "target": "qeva:1:terminology:chaos",
      "note": "Some definitions of chaos include sensitivity; others formulate chaos differently."
    }
  ],
  "verification": {
    "level": "editorial",
    "method": "Definition checked for internal consistency; not yet linked to an external formal proof artifact.",
    "artifact": null
  },
  "provenance": {
    "created": "2026-09-04",
    "creator": "QEVA seed archive",
    "license": "CC0-1.0",
    "source_note": "Seed record written to demonstrate QEVA Protocol 0.1; it is not claimed to be the unique foundational presentation of this concept."
  },
  "revision_of": null
}
