{
  "qeva_version": "0.1",
  "id": "qeva:1:definition:prime",
  "revision": 1,
  "type": "definition",
  "title": "Prime number",
  "summary": "A positive integer greater than 1 with no positive divisors other than 1 and itself.",
  "status": "formalized",
  "context": {
    "domain": [
      "number",
      "arithmetic"
    ],
    "formal_system": "positive integers with ordinary multiplication and divisibility",
    "scope_note": null
  },
  "assumptions": [],
  "content": {
    "human": "A prime cannot be factored into two smaller positive integers greater than 1.",
    "exact": "For p in Z with p>1, p is prime iff for every positive integer d, d divides p implies d=1 or d=p.",
    "example": "7 is prime. 12 is not prime because 3 divides 12 and 3 is neither 1 nor 12.",
    "caveat": "This seed record uses the standard positive-integer definition; “prime elements” in general rings require separate contextual definitions."
  },
  "dependencies": [],
  "relations": [],
  "verification": {
    "level": "editorial",
    "method": "Definition checked for internal consistency; not yet linked to an external formal proof artifact.",
    "artifact": null
  },
  "provenance": {
    "created": "2026-09-04",
    "creator": "QEVA seed archive",
    "license": "CC0-1.0",
    "source_note": "Seed record written to demonstrate QEVA Protocol 0.1; it is not claimed to be the unique foundational presentation of this concept."
  },
  "revision_of": null
}
