{
  "qeva_version": "0.1",
  "id": "qeva:1:definition:parity",
  "revision": 1,
  "type": "definition",
  "title": "Parity",
  "summary": "Classification of integers by their remainder modulo 2.",
  "status": "formalized",
  "context": {
    "domain": [
      "number",
      "arithmetic"
    ],
    "formal_system": "integers with ordinary arithmetic",
    "scope_note": null
  },
  "assumptions": [],
  "content": {
    "human": "Every integer belongs to one of two classes: even or odd.",
    "exact": "For n in Z: n is even iff there exists k in Z with n=2k. n is odd iff there exists k in Z with n=2k+1.",
    "example": "18 is even because 18=2·9. 19 is odd because 19=2·9+1.",
    "caveat": null
  },
  "dependencies": [],
  "relations": [
    {
      "kind": "instance-of",
      "target": "qeva:1:definition:equivalence",
      "note": "Parity classes arise from congruence modulo 2."
    }
  ],
  "verification": {
    "level": "editorial",
    "method": "Definition checked for internal consistency; not yet linked to an external formal proof artifact.",
    "artifact": null
  },
  "provenance": {
    "created": "2026-09-04",
    "creator": "QEVA seed archive",
    "license": "CC0-1.0",
    "source_note": "Seed record written to demonstrate QEVA Protocol 0.1; it is not claimed to be the unique foundational presentation of this concept."
  },
  "revision_of": null
}
