{
  "qeva_version": "0.1",
  "id": "qeva:1:definition:sequence",
  "revision": 1,
  "type": "definition",
  "title": "Sequence",
  "summary": "An ordered family of values indexed by a specified set, usually the natural numbers.",
  "status": "formalized",
  "context": {
    "domain": [
      "structure",
      "number",
      "dynamics"
    ],
    "formal_system": "standard functions",
    "scope_note": null
  },
  "assumptions": [
    "An index set I and codomain X are specified."
  ],
  "content": {
    "human": "A sequence is not merely a written list; mathematically it is a function whose input is an index.",
    "exact": "A sequence in X indexed by I is a function a:I→X. When I=N, the value at n is written a_n.",
    "example": "The sequence 1,2,4,8,... can be represented by a_n=2^n for n=0,1,2,...",
    "caveat": null
  },
  "dependencies": [],
  "relations": [
    {
      "kind": "supports",
      "target": "qeva:1:definition:recurrence",
      "note": "Recurrence relations constrain indexed values of sequences."
    },
    {
      "kind": "supports",
      "target": "qeva:1:definition:periodicity",
      "note": "Sequence periodicity compares values at shifted indices."
    }
  ],
  "verification": {
    "level": "editorial",
    "method": "Definition checked for internal consistency; not yet linked to an external formal proof artifact.",
    "artifact": null
  },
  "provenance": {
    "created": "2026-09-04",
    "creator": "QEVA seed archive",
    "license": "CC0-1.0",
    "source_note": "Seed record written to demonstrate QEVA Protocol 0.1; it is not claimed to be the unique foundational presentation of this concept."
  },
  "revision_of": null
}
