{
  "qeva_version": "0.1",
  "id": "qeva:1:concept:halving",
  "revision": 1,
  "type": "concept",
  "title": "Halving",
  "summary": "The inverse problem to doubling, defined only when the ambient structure makes division by 2 meaningful or solvable.",
  "status": "context-dependent",
  "context": {
    "domain": [
      "number",
      "algebra",
      "structure"
    ],
    "formal_system": null,
    "scope_note": null
  },
  "assumptions": [],
  "content": {
    "human": "“Half of x” is not one universal operation. It depends on what x is and which operations exist in its mathematical structure.",
    "exact": "Given a structure with an addition operation, y is a half of x when y+y=x. A unique halving operation x↦x/2 exists only in contexts where this equation has exactly one solution y for each x under consideration.",
    "example": "In the real numbers, half of 7 is 7/2. In the integers, 7 has no integer half. In arithmetic modulo 5, 2 has a unique multiplicative inverse 3, so division by 2 is well-defined.",
    "caveat": "The existence and uniqueness of halves depend on the ambient algebraic structure."
  },
  "dependencies": [],
  "relations": [],
  "verification": {
    "level": "editorial",
    "method": "Definition checked for internal consistency; not yet linked to an external formal proof artifact.",
    "artifact": null
  },
  "provenance": {
    "created": "2026-09-04",
    "creator": "QEVA seed archive",
    "license": "CC0-1.0",
    "source_note": "Seed record written to demonstrate QEVA Protocol 0.1; it is not claimed to be the unique foundational presentation of this concept."
  },
  "revision_of": null
}
