{
  "qeva_version": "0.1",
  "id": "qeva:1:definition:invariant",
  "revision": 1,
  "type": "definition",
  "title": "Invariant",
  "summary": "A quantity or property unchanged by a specified family of transformations.",
  "status": "formalized",
  "context": {
    "domain": [
      "symmetry",
      "structure",
      "dynamics"
    ],
    "formal_system": "group actions",
    "scope_note": null
  },
  "assumptions": [
    "A group G acts on a set X.",
    "A function I maps X to a set Y."
  ],
  "content": {
    "human": "An invariant deliberately forgets changes that the chosen transformations are allowed to make.",
    "exact": "I:X→Y is invariant under G iff for every g in G and x in X, I(g·x)=I(x).",
    "example": "The Euclidean distance between two points is invariant under rigid motions applied to both points.",
    "caveat": "Changing the transformation family changes which quantities qualify as invariants."
  },
  "dependencies": [
    "qeva:1:definition:symmetry"
  ],
  "relations": [],
  "verification": {
    "level": "editorial",
    "method": "Definition checked for internal consistency; not yet linked to an external formal proof artifact.",
    "artifact": null
  },
  "provenance": {
    "created": "2026-09-04",
    "creator": "QEVA seed archive",
    "license": "CC0-1.0",
    "source_note": "Seed record written to demonstrate QEVA Protocol 0.1; it is not claimed to be the unique foundational presentation of this concept."
  },
  "revision_of": null
}
